{
  "contract": "business-flow-documentation",
  "contractVersion": "0.1.0-draft",
  "flows": [
    {
      "id": "generic-device-operation-request",
      "defaultLocale": "zh-CN",
      "privacyClass": "public",
      "labels": {
        "zh-CN": "通用设备操作请求",
        "en": "Generic device operation request"
      },
      "entryNodeId": "start.request-received",
      "endNodeIds": [
        "end.failed",
        "end.rejected",
        "end.success"
      ]
    }
  ],
  "nodes": [
    {
      "id": "actor.audit-service",
      "flowId": "generic-device-operation-request",
      "kind": "actor",
      "actorKind": "system-role",
      "privacyClass": "public",
      "labels": {
        "zh-CN": "审计服务",
        "en": "Audit service"
      },
      "authorship": "author-provided"
    },
    {
      "id": "actor.business-service",
      "flowId": "generic-device-operation-request",
      "kind": "actor",
      "actorKind": "system-role",
      "privacyClass": "public",
      "labels": {
        "zh-CN": "业务服务",
        "en": "Business service"
      },
      "authorship": "author-provided"
    },
    {
      "id": "actor.device-gateway",
      "flowId": "generic-device-operation-request",
      "kind": "actor",
      "actorKind": "system-role",
      "privacyClass": "public",
      "labels": {
        "zh-CN": "设备网关",
        "en": "Device gateway"
      },
      "authorship": "author-provided"
    },
    {
      "id": "actor.operator",
      "flowId": "generic-device-operation-request",
      "kind": "actor",
      "actorKind": "human-role",
      "privacyClass": "public",
      "labels": {
        "zh-CN": "操作员角色",
        "en": "Operator role"
      },
      "authorship": "author-provided"
    },
    {
      "id": "actor.policy-service",
      "flowId": "generic-device-operation-request",
      "kind": "actor",
      "actorKind": "system-role",
      "privacyClass": "public",
      "labels": {
        "zh-CN": "策略服务",
        "en": "Policy service"
      },
      "authorship": "author-provided"
    },
    {
      "id": "artifact.audit-record",
      "flowId": "generic-device-operation-request",
      "kind": "artifact",
      "artifactKind": "record",
      "privacyClass": "public",
      "labels": {
        "zh-CN": "审计记录类型",
        "en": "Audit record type"
      },
      "authorship": "author-provided"
    },
    {
      "id": "artifact.dispatch-receipt",
      "flowId": "generic-device-operation-request",
      "kind": "artifact",
      "artifactKind": "message",
      "privacyClass": "public",
      "labels": {
        "zh-CN": "下发回执类型",
        "en": "Dispatch receipt type"
      },
      "authorship": "author-provided"
    },
    {
      "id": "artifact.operation-request",
      "flowId": "generic-device-operation-request",
      "kind": "artifact",
      "artifactKind": "data",
      "privacyClass": "public",
      "labels": {
        "zh-CN": "操作请求类型",
        "en": "Operation request type"
      },
      "authorship": "author-provided"
    },
    {
      "id": "artifact.validation-result",
      "flowId": "generic-device-operation-request",
      "kind": "artifact",
      "artifactKind": "data",
      "privacyClass": "public",
      "labels": {
        "zh-CN": "校验结果类型",
        "en": "Validation result type"
      },
      "authorship": "author-provided"
    },
    {
      "id": "decision.request-authorized",
      "flowId": "generic-device-operation-request",
      "kind": "decision",
      "privacyClass": "public",
      "labels": {
        "zh-CN": "请求是否已授权",
        "en": "Is the request authorized"
      },
      "authorship": "author-provided"
    },
    {
      "id": "decision.request-valid",
      "flowId": "generic-device-operation-request",
      "kind": "decision",
      "privacyClass": "public",
      "labels": {
        "zh-CN": "请求是否有效",
        "en": "Is the request valid"
      },
      "authorship": "author-provided"
    },
    {
      "id": "end.failed",
      "flowId": "generic-device-operation-request",
      "kind": "end",
      "outcome": "failed",
      "privacyClass": "public",
      "labels": {
        "zh-CN": "处理失败",
        "en": "Processing failed"
      },
      "authorship": "author-provided"
    },
    {
      "id": "end.rejected",
      "flowId": "generic-device-operation-request",
      "kind": "end",
      "outcome": "rejected",
      "privacyClass": "public",
      "labels": {
        "zh-CN": "请求被拒绝",
        "en": "Request rejected"
      },
      "authorship": "author-provided"
    },
    {
      "id": "end.success",
      "flowId": "generic-device-operation-request",
      "kind": "end",
      "outcome": "success",
      "privacyClass": "public",
      "labels": {
        "zh-CN": "处理成功",
        "en": "Processing succeeded"
      },
      "authorship": "author-provided"
    },
    {
      "id": "merge.rejection-paths",
      "flowId": "generic-device-operation-request",
      "kind": "merge",
      "privacyClass": "public",
      "labels": {
        "zh-CN": "汇合拒绝路径",
        "en": "Merge rejection paths"
      },
      "authorship": "author-provided"
    },
    {
      "id": "start.request-received",
      "flowId": "generic-device-operation-request",
      "kind": "start",
      "privacyClass": "public",
      "labels": {
        "zh-CN": "收到操作请求",
        "en": "Operation request received"
      },
      "authorship": "author-provided"
    },
    {
      "id": "step.authorize-request",
      "flowId": "generic-device-operation-request",
      "kind": "step",
      "privacyClass": "public",
      "labels": {
        "zh-CN": "授权请求",
        "en": "Authorize request"
      },
      "authorship": "author-provided"
    },
    {
      "id": "step.dispatch-operation",
      "flowId": "generic-device-operation-request",
      "kind": "step",
      "privacyClass": "public",
      "labels": {
        "zh-CN": "下发操作",
        "en": "Dispatch operation"
      },
      "authorship": "author-provided"
    },
    {
      "id": "step.notify-failure",
      "flowId": "generic-device-operation-request",
      "kind": "step",
      "privacyClass": "public",
      "labels": {
        "zh-CN": "通知失败结果",
        "en": "Notify failure outcome"
      },
      "authorship": "author-provided"
    },
    {
      "id": "step.notify-rejection",
      "flowId": "generic-device-operation-request",
      "kind": "step",
      "privacyClass": "public",
      "labels": {
        "zh-CN": "通知拒绝结果",
        "en": "Notify rejection outcome"
      },
      "authorship": "author-provided"
    },
    {
      "id": "step.notify-success",
      "flowId": "generic-device-operation-request",
      "kind": "step",
      "privacyClass": "public",
      "labels": {
        "zh-CN": "通知成功结果",
        "en": "Notify success outcome"
      },
      "authorship": "author-provided"
    },
    {
      "id": "step.persist-success",
      "flowId": "generic-device-operation-request",
      "kind": "step",
      "privacyClass": "public",
      "labels": {
        "zh-CN": "记录成功结果",
        "en": "Persist success outcome"
      },
      "authorship": "author-provided"
    },
    {
      "id": "step.record-failure",
      "flowId": "generic-device-operation-request",
      "kind": "step",
      "privacyClass": "public",
      "labels": {
        "zh-CN": "记录失败结果",
        "en": "Record failure outcome"
      },
      "authorship": "author-provided"
    },
    {
      "id": "step.record-rejection",
      "flowId": "generic-device-operation-request",
      "kind": "step",
      "privacyClass": "public",
      "labels": {
        "zh-CN": "记录拒绝结果",
        "en": "Record rejection outcome"
      },
      "authorship": "author-provided"
    },
    {
      "id": "step.validate-request",
      "flowId": "generic-device-operation-request",
      "kind": "step",
      "privacyClass": "public",
      "labels": {
        "zh-CN": "校验请求",
        "en": "Validate request"
      },
      "authorship": "author-provided"
    }
  ],
  "relations": [
    {
      "id": "control.01-received-to-validate",
      "flowId": "generic-device-operation-request",
      "family": "control",
      "kind": "sequence",
      "from": "start.request-received",
      "to": "step.validate-request",
      "order": 0,
      "authorship": "author-provided",
      "quality": {
        "resolution": "not-applicable",
        "confidence": "high",
        "provenance": {
          "origin": "author-provided",
          "evidenceRefs": [
            "evidence.synthetic-author"
          ]
        }
      }
    },
    {
      "id": "control.02-validate-to-validity",
      "flowId": "generic-device-operation-request",
      "family": "control",
      "kind": "sequence",
      "from": "step.validate-request",
      "to": "decision.request-valid",
      "order": 0,
      "authorship": "author-provided",
      "quality": {
        "resolution": "not-applicable",
        "confidence": "high",
        "provenance": {
          "origin": "author-provided",
          "evidenceRefs": [
            "evidence.synthetic-author"
          ]
        }
      }
    },
    {
      "id": "control.03-valid-to-authorize",
      "flowId": "generic-device-operation-request",
      "family": "control",
      "kind": "branch",
      "from": "decision.request-valid",
      "to": "step.authorize-request",
      "order": 0,
      "caseKey": "valid",
      "authorship": "author-provided",
      "quality": {
        "resolution": "not-applicable",
        "confidence": "high",
        "provenance": {
          "origin": "author-provided",
          "evidenceRefs": [
            "evidence.synthetic-author"
          ]
        }
      }
    },
    {
      "id": "control.04-invalid-to-rejection-merge",
      "flowId": "generic-device-operation-request",
      "family": "control",
      "kind": "branch",
      "from": "decision.request-valid",
      "to": "merge.rejection-paths",
      "order": 1,
      "caseKey": "invalid",
      "authorship": "author-provided",
      "quality": {